{
  "schema_version": "1.0.0",
  "generated_at_utc": "2026-02-19T00:27:22Z",
  "multilingual_titles": {
    "en": "Global Observation & Production Index",
    "fr": "Index Mondial d'Observation et de Production",
    "de": "Globaler Beobachtungs- und Produktionsindex",
    "ru": "Глобальный индекс наблюдений и производства",
    "zh": "全球观测与生产指数",
    "ar": "مؤشر المراقبة والإنتاج العالمي"
  },
  "sources": [
    {
      "repo_id": "AUTO-DZ-ACT-3I-ATLAS-DAILY",
      "repo_name": "AUTO-DZ-ACT-3I-ATLAS-DAILY",
      "owner": "abdelkader-omran",
      "role": "raw"
    },
    {
      "repo_id": "AUTO-DZ-ACT-ANALYSIS-3I-ATLAS",
      "repo_name": "AUTO-DZ-ACT-ANALYSIS-3I-ATLAS",
      "owner": "abdelkader-omran",
      "role": "analysis"
    },
    {
      "repo_id": "trizel-AI",
      "repo_name": "trizel-AI",
      "owner": "abdelkader-omran",
      "role": "analysis"
    },
    {
      "repo_id": "trizel-monitor",
      "repo_name": "trizel-monitor",
      "owner": "abdelkader-omran",
      "role": "monitor"
    },
    {
      "repo_id": "trizel-lab",
      "repo_name": "trizel-lab",
      "owner": "trizel-ai-site",
      "role": "lab"
    },
    {
      "repo_id": "Auto-dz-act",
      "repo_name": "Auto-dz-act",
      "owner": "trizel-ai",
      "role": "raw"
    },
    {
      "repo_id": "trizel-monitor-org",
      "repo_name": "trizel-monitor",
      "owner": "trizel-ai",
      "role": "monitor"
    }
  ],
  "observation_ledger": [
    {
      "observation_id": "TESS-SECTOR-1751-3I-ATLAS",
      "mission": "TESS",
      "sector": "1751",
      "target": "3I/ATLAS",
      "observation_type": "special",
      "date_start": "2026-01-15T06:04:18Z",
      "date_end": "2026-01-19T23:59:59Z",
      "status": "data-available",
      "metadata_file": "sources/tess-sector-1751-3i-atlas.json",
      "documentation": "/docs/TESS_SECTOR_1751_MISSION_STATUS.md",
      "last_updated_utc": "2026-02-19T00:27:22Z"
    }
  ],
  "production_ledger": [],
  "snapshots_registry": []
}
